Filename,Keywords
JD 1.txt,"typescript, angular, react, java, redux, css, json, node, html, javascript"
JD 10.txt,"typescript, sql, python, react"
JD 100.txt,"react, mongodb, java, css, xml, jquery, sql, mysql, javascript"
JD 11.txt,"angular, python, java, css, sql, vue.js, git, html, javascript"
JD 12.txt,"react, mongodb, python, java, css, sql, django, mysql, node, html, javascript"
JD 13.txt,"python, java"
JD 14.txt,"typescript, python, java, css, sql, mysql, html, javascript"
JD 15.txt,"sql, python"
JD 16.txt,"angular, python, css, sql, git, github, html, ajax"
JD 17.txt,"angular, react, bootstrap, mongodb, python, java, css, sql, vue.js, git, jquery, mysql, node, html, javascript"
JD 18.txt,"angular, react, java, sql, html, javascript"
JD 19.txt,"angular, react, mongodb, php, python, java, css, xml, sql, git, json, mysql, node, html, javascript"
JD 2.txt,"java, css, jquery, sql, mysql, html, javascript"
JD 20.txt,
JD 21.txt,"php, python, java, css, git, html, javascript"
JD 22.txt,"react, mongodb, java, sql, git, mysql, javascript"
JD 23.txt,"angular, react, springboot, java, sql, html5, html, javascript"
JD 24.txt,"angular, mongodb, java, css, git, html, javascript"
JD 25.txt,git
JD 26.txt,angular
JD 27.txt,"angular, java, css, git, html, javascript"
JD 28.txt,react
JD 29.txt,"angular, java, sql, git, json, mysql"
JD 3.txt,"springboot, java"
JD 30.txt,"angular, react, python, css, html, flask"
JD 31.txt,"angular, react, java, css, jquery, vue.js, django, sql, mysql, html, flask, javascript"
JD 32.txt,"react, java, css, html5, html, javascript"
JD 33.txt,"angular, java, css, sql, git, mysql, html, javascript"
JD 34.txt,"react, bootstrap, mongodb, redis, css, sql, mysql, node, html"
JD 35.txt,"angular, java, css, git, html, javascript"
JD 36.txt,"typescript, react, python, sql, git"
JD 37.txt,"angular, php, java, css, sql, mysql, laravel, javascript"
JD 38.txt,"angular, react, bootstrap, python, java, sql, vue.js, javascript"
JD 39.txt,"java, react, javascript, json"
JD 4.txt,"python, java, css, sql, django, html5, html, flask, javascript"
JD 40.txt,"typescript, react, mongodb, java, css, redux, sql, git, mysql, html, javascript"
JD 41.txt,"angular, java, css, sql, git, mysql, html, javascript"
JD 42.txt,"php, java, sql, html, laravel, javascript"
JD 43.txt,"angular, mongodb, php, python, java, sql, django, git, mysql, node, laravel, javascript"
JD 44.txt,"react, mongodb, python, java, sql, django, mysql, javascript"
JD 45.txt,"react, java, css, redux, xml, jquery, sql, html, javascript"
JD 46.txt,"angular, react, mongodb, python, java, css, xml, jquery, sql, mysql, javascript"
JD 47.txt,"react, java, sql, node, javascript"
JD 48.txt,
JD 49.txt,"typescript, angular, html5, bootstrap, java, css, sql, jquery, git, mysql, html, javascript"
JD 5.txt,"react, bootstrap, python, java, css, sql, vue.js, django, git, jquery, javascript"
JD 50.txt,"react, bootstrap, css, html, ajax"
JD 51.txt,"angular, typescript, react, java, sql, git, github, javascript"
JD 52.txt,"typescript, react, python, java, css, git, javascript"
JD 53.txt,"git, react, java"
JD 54.txt,"typescript, react, python, java, css, git, javascript"
JD 55.txt,"typescript, html5, react, mongodb, java, css, sql, git, mysql, html, javascript"
JD 56.txt,"react, java, css, sql, git, html, javascript"
JD 57.txt,"react, python, css, sql, django, git, mysql, github, html, flask"
JD 58.txt,"react, mongodb, java, css, sql, git, mysql, html, javascript"
JD 59.txt,"typescript, react, java, redux, sql, git, javascript"
JD 6.txt,"angular, react, bootstrap, java, css, html5, html, javascript"
JD 60.txt,"react, java, css, git, html, javascript"
JD 61.txt,"react, mongodb, python, java, css, xml, jquery, sql, mysql, javascript"
JD 62.txt,"mongodb, react, javascript, java"
JD 63.txt,"react, java, css, sql, git, html, javascript"
JD 64.txt,git
JD 65.txt,"angular, react, mongodb, php, python, java, css, sql, vue.js, git, mysql, html, javascript"
JD 66.txt,"angular, react, python, java, sql, git, javascript"
JD 67.txt,"node, git, react"
JD 68.txt,"typescript, react, java, css, redux, html, javascript"
JD 69.txt,"git, github, java"
JD 7.txt,"python, java, sql, mysql, html, javascript"
JD 70.txt,"http, react"
JD 71.txt,"react, python, sql, git, github, node, flask"
JD 72.txt,"angular, mongodb, python, sql, git, mysql"
JD 73.txt,"http, bitbucket, git"
JD 74.txt,"typescript, react, javascript, java"
JD 75.txt,"typescript, mongodb, java, redux, git, node, html, javascript"
JD 76.txt,"sql, redis, git, java"
JD 77.txt,"mongodb, react"
JD 78.txt,"angular, typescript, java, css, html, javascript"
JD 79.txt,
JD 8.txt,"react, python, java, sql, github, flask, php, xml, node, angular, typescript, css, jquery, vue.js, git, django, html, mongodb, mysql, javascript"
JD 80.txt,"angular, react, python, sql, django, flask"
JD 81.txt,"angular, bootstrap, java, css, jquery, html5, html, javascript"
JD 82.txt,"typescript, redis, java, css, javascript"
JD 83.txt,"react, css, html5, node, html"
JD 84.txt,"react, java, css, redux, json, git, html5, html, javascript"
JD 85.txt,python
JD 86.txt,"java, css, sql, git, json, html, javascript"
JD 87.txt,"react, java, css, sql, git, html, javascript"
JD 88.txt,"angular, react, mongodb, php, python, java, css, sql, vue.js, git, mysql, html, javascript"
JD 89.txt,git
JD 9.txt,"html, sql, java"
JD 90.txt,"typescript, react, javascript, java"
JD 91.txt,"angular, java, css, sql, git, node, html, javascript"
JD 92.txt,"python, java, css, git, html5, html, javascript"
JD 93.txt,"angular, sql"
JD 94.txt,"python, java, css, sql, django, html, javascript"
JD 95.txt,"angular, react, mongodb, python, java, css, sql, mysql, html, flask, javascript"
JD 96.txt,"angular, react, mongodb, python, java, css, sql, vue.js, django, git, mysql, html, flask, javascript"
JD 97.txt,"sql, git, github"
JD 98.txt,
JD 99.txt,"angular, php, sql, mysql, laravel"
