Company,Job Title,Keywords,Filename
Bonami Software,React JS | JavaScript Developer,"javascript, redux, react, json, css, angular, java, html, typescript, node",JD 1.txt
Wilatons,Full Stack Developer,"python, typescript, react, sql",JD 10.txt
Saapttrini Software Solutions Pvt. Ltd.,Full Stack Developer,"java, mongodb, javascript, sql, mysql, react, css, xml, jquery",JD 100.txt
Krishworks Technology And Research Labs,Fullstack Web Developer,"java, django, mongodb, javascript, python, mysql, react, css, sql, html, node",JD 12.txt
HTD Careers,Software Engineer Trainee,"python, java",JD 13.txt
Berryworks,Engineering Trainee - Full Stack and AI,"python, sql",JD 15.txt
Godigi Infotech,Full Stack Developer,"python, angular, css, git, github, sql, html, ajax",JD 16.txt
Mantras2Success Consultants,Lead Full Stack Developer (Python + Angular/React),"xml, mongodb, javascript, sql, python, mysql, react, angular, css, json, git, java, html, node, php",JD 19.txt
Accenture,Application Developer,"javascript, sql, mysql, css, java, html, jquery",JD 2.txt
SharpCode,Full Stack Developer,"javascript, python, css, git, java, html, php",JD 21.txt
Chalanas,Full Stack Developer,"mongodb, javascript, sql, mysql, react, git, java",JD 22.txt
Barclays,Full Stack Developer,"java, javascript, react, angular, html5, sql, html, springboot",JD 23.txt
Digitech Sols,Full Stack Developer,"mongodb, javascript, angular, css, git, java, html",JD 24.txt
GE Digital,Full Stack Developer,git,JD 25.txt
Intouch CX,Full Stack Developer,angular,JD 26.txt
EthAum Venture Partners,Full Stack Developer,"javascript, angular, css, git, java, html",JD 27.txt
Purecode.ai,Full Stack Developer,react,JD 28.txt
Finflux,Full Stack Developer,"sql, mysql, angular, json, git, java",JD 29.txt
Futures First,Full Stack Developer,"python, react, angular, css, flask, html",JD 30.txt
ZOG Global,Full Stack Developer,"vue.js, django, javascript, sql, mysql, react, angular, css, flask, java, html, jquery",JD 31.txt
Inputzero Technologies,Full Stack Developer,"javascript, react, css, html5, java, html",JD 32.txt
AvenDATA GmbH,Full Stack Developer,"java, javascript, mysql, angular, css, git, sql, html",JD 33.txt
Hero MotoCorp Limited,Full Stack Developer,"bootstrap, mongodb, mysql, react, redis, css, sql, html, node",JD 34.txt
Insight Gro,Full Stack Developer,"javascript, angular, css, git, java, html",JD 35.txt
Consultbae,Full Stack Developer,"python, react, git, sql, typescript",JD 36.txt
XynoSoft,Full Stack Developer,"laravel, javascript, sql, mysql, angular, css, java, php",JD 37.txt
Emerson,Full Stack Developer,"bootstrap, vue.js, javascript, sql, python, react, angular, java",JD 38.txt
Techplek,Full Stack Developer,"react, json, javascript, java",JD 39.txt
Nexpro247,Python Developer,"java, django, javascript, python, flask, css, html5, sql, html",JD 4.txt
Novisync,Full Stack Developer,"mongodb, javascript, sql, redux, react, mysql, css, git, java, html, typescript",JD 40.txt
AvenDATA GmbH,Full Stack Developer,"java, javascript, mysql, angular, css, git, sql, html",JD 41.txt
Agnito,Full Stack Developer,"laravel, java, javascript, sql, html, php",JD 42.txt
Techies,Full Stack Developer,"laravel, mongodb, django, javascript, sql, python, mysql, angular, git, java, node, php",JD 43.txt
APT Portfolio,Full Stack Developer,"mongodb, django, javascript, sql, python, mysql, react, java",JD 44.txt
Codingmart Technologies,Full Stack Developer,"xml, javascript, sql, redux, react, css, java, html, jquery",JD 45.txt
Inspiroz IT Services,Full Stack Developer,"java, mongodb, javascript, sql, python, mysql, react, angular, css, xml, jquery",JD 46.txt
H K Infosoft,Full Stack Developer,"java, javascript, react, sql, node",JD 47.txt
Vertoz,Full Stack Developer,"bootstrap, java, javascript, mysql, angular, css, html5, git, sql, html, jquery, typescript",JD 49.txt
Ramboll,Full Stack Developer,"bootstrap, react, css, html, ajax",JD 50.txt
EY,WAM-Fullstack Developer-Staff ,"java, javascript, react, angular, git, github, sql, typescript",JD 51.txt
delaPlex,Full Stack Developer - React.js/Python,"javascript, python, react, css, git, java, typescript",JD 52.txt
Infosys,Java and React JS Developer,"git, react, java",JD 53.txt
delaPlex,Full Stack Developer (React and Python),"javascript, python, react, css, git, java, typescript",JD 54.txt
Oaza Energy,Full Stack Developer,"mongodb, javascript, sql, mysql, react, css, html5, git, java, html, typescript",JD 55.txt
ConsultBae Jobs,Junior Full Stack Developer,"java, javascript, react, css, git, sql, html",JD 56.txt
Forward CV,Python Developer,"django, python, mysql, react, flask, css, git, github, sql, html",JD 57.txt
SR Analytics,MERN/PERN Stack Developer - React.js/Node.js,"mongodb, java, javascript, mysql, react, css, git, sql, html, node",JD 58.txt
STAND 8 Technology Services,Full Stack Developer,"javascript, sql, redux, react, git, java, typescript",JD 59.txt
Primohunt Corporate,Full Stack Developer - JAVA / Angular,"bootstrap, javascript, react, angular, css, html5, java, html",JD 6.txt
Cloudstaff,Full Stack Developer,"java, mongodb, javascript, sql, python, mysql, react, css, xml, jquery",JD 61.txt
Onelab Ventures,SDE-1 (Mern Stack),"mongodb, react, javascript, java",JD 62.txt
ThreatXIntel,Freelance Full-Stack Developer - React/.NET Core,"javascript, sql, react, css, git, java, html",JD 63.txt
Efficient,Full Stack Developer,git,JD 64.txt
Unanime Planet,Full Stack Engineer,"mongodb, vue.js, javascript, sql, python, mysql, react, angular, css, git, java, html, php",JD 65.txt
Eshcol Global Services Private Limited,Software Developer,"javascript, sql, python, react, angular, git, java",JD 66.txt
Infosys,Node JS Developer,"git, react, node",JD 67.txt
Infosys,React.JS Developer,"javascript, redux, react, css, java, html, typescript",JD 68.txt
Varian,Software Engineer,"git, github, java",JD 69.txt
Accenture,Application Developer,"javascript, sql, python, mysql, java, html",JD 7.txt
uParcel,Full Stack Engineer,"http, react",JD 70.txt
Dendrite.ai,Full Stack Web Developer - Python(Flask) with React/NodeJS,"python, react, flask, git, github, sql, node",JD 71.txt
Ellenox,Full Stack Engineer,"mongodb, python, mysql, angular, git, sql",JD 72.txt
Community Brands,Software Developer,"http, git, bitbucket",JD 73.txt
TIGI HR,Full Stack Engineer,"typescript, react, javascript, java",JD 74.txt
METAVERSE VENTURES PRIVATE LIMITED,Full Stack Developer,"mongodb, javascript, redux, git, java, html, typescript, node",JD 75.txt
Mastercard,Software Engineer II,"redis, git, sql, java",JD 76.txt
Ellty,Full Stack Engineer,"mongodb, react",JD 77.txt
QBH Solution Pvt. Ltd. (QBH SOFT),Angular & Nest JS Full Stack Developer,"javascript, angular, css, java, html, typescript",JD 78.txt
Kezan Consulting,Java Full Stack Developer,"vue.js, react, git, jquery, typescript, node, mongodb, python, mysql, github, xml, django, angular, sql, java, php, javascript, css, flask, html",JD 8.txt
IntegriChain,Software Engineer,"django, python, react, angular, flask, sql",JD 80.txt
eClerx,Associate Process Manager - Web Developer,"bootstrap, javascript, angular, css, html5, java, html, jquery",JD 81.txt
ePiphany AI,Full Stack Developer,"javascript, redis, css, java, typescript",JD 82.txt
Nidish,Full Stack Developer (Flutter + Node.js),"react, css, html5, html, node",JD 83.txt
Confidential,Java Full Stack Developer,"javascript, redux, react, json, css, html5, git, java, html",JD 84.txt
Informica Solutions ,AWS developer + python,"python, java",JD 85.txt
Sparkmetrics Solutions ,Full Stack Developer,"javascript, sql, json, css, git, java, html",JD 86.txt
ThreatXIntel,Full Stack Developer - React/.NET Core,"javascript, sql, react, css, git, java, html",JD 87.txt
ThreatXIntel,Full Stack Developer - React/.NET Core,"mongodb, vue.js, javascript, sql, python, mysql, react, angular, css, git, java, html, php",JD 88.txt
VRWorld,Full Stack Developer,git,JD 89.txt
Accenture,Application Developer,"html, sql, java",JD 9.txt
TIGI HR,Full Stack Engineer,"typescript, react, javascript, java",JD 90.txt
r3 Consultant,Full Stack Engineer (Nodejs+Angular+Weblogic),"javascript, sql, angular, css, git, java, html, node",JD 91.txt
Supply Wisdom,Full Stack Developer,"javascript, python, css, html5, git, java, html",JD 92.txt
Shreeji Enterprise,Full Stack Developer,"angular, sql",JD 93.txt
Findoc,Full Stack Developer,"django, javascript, sql, python, css, java, html",JD 94.txt
Vision Mechatronics,Full Stack Developer,"mongodb, javascript, sql, python, mysql, react, angular, css, flask, java, html",JD 95.txt
ITIO Innovaxe Private Limited,Python Full Stack Developer,"mongodb, vue.js, django, javascript, sql, python, mysql, react, angular, css, flask, git, java, html",JD 96.txt
Vieg Services Pvt Ltd,Full Stack Developer,"git, github, sql",JD 97.txt
Unstop,Full Stack Developer,"laravel, mysql, angular, sql, php",JD 99.txt
